{
  "config_snapshot": {
    "atomic_note_template": "Templates/Atomic Note Template.md",
    "atomic_notes_folder": "Atomic Notes",
    "audit_output_folder": "Reviews/Atomic Note Audits",
    "schema_version": "1.0.0",
    "structure_notes_folder": "Structure Notes"
  },
  "ended_at": "2000-01-01T00:00:00Z",
  "errors": [],
  "outputs": {
    "audit_rows": "fixture-audit.jsonl",
    "manifest": "fixture-manifest.json"
  },
  "priority_counts": {
    "P0": 2,
    "P1": 1,
    "P2": 4,
    "P3": 2,
    "no_change": 4
  },
  "row_status_counts": {
    "complete": 13,
    "error": 0,
    "reused_cache": 0,
    "skipped": 0
  },
  "run_id": "fixture-run",
  "schema_version": "1.0.0",
  "started_at": "2000-01-01T00:00:00Z",
  "total_notes": 13,
  "validation_status": "not_run"
}
